citation,agency,organization,journal,university,book
"NMFS. 2002b. Regulatory Impact Review and Regulatory Flexibility Act Analysis for Making Technical Changes to TEDs to Enhance Turtle Protection in the Southeastern United States Under Sea Turtle Conservation Regulations. National Marine Fisheries Service, St. Petersburg, Florida, 55 pp. ",NOAA,,,,
"NMFS. 2005. Recovery plan for the North Atlantic right whale (Eubalaena glacialis). National Marine Fisheries Service, Silver Spring, Maryland. ",NOAA,,,,
"NMFS. 2006a. Final consolidated Atlantic highly migratory species fishery management plan. July 2006. National Marine Fisheries Service, Office of Sustainable Fisheries, Highly Migratory Species Management Division, Silver Spring, Maryland. ",NOAA,,,,
"NMFS. 2006b. Endangered Species Act Section 7 consultation on the continued authorization of snapper-grouper fishing in the U.S. South Atlantic exclusive economic zone (EEZ) as managed under the Snapper-Grouper Fishery Management Plan (SGFMP) of the South Atlantic region, including Amendment 13C to the SGFMP. June 7, 2006. ",NOAA,,,,
"NMFS. 2007. Status review of Atlantic sturgeon (Acipenser oxyrinchus oxyrinchus). Prepared by the Atlantic Sturgeon Status Review Team for the National Marine Fisheries Service, Northeast Regional Office, 174 pp. ",NOAA,,,,
"NMFS. 2008. Final environmental impact statement to implement vessel operational measures to reduce ship strikes to North Atlantic right whales. National Marine Fisheries Service, Silver Spring, Maryland. ",NOAA,,,,
"NMFS. 2009a. An assessment of loggerhead sea turtles to estimate impacts of mortality on population dynamics. National Oceanic and Atmospheric Administration, National Marine Fisheries Service, Southeast Fisheries Science Center, PRD-08/09-14. ",NOAA,,,,
"NMFS. 2009b. Smalltooth sawfish recovery plan. National Marine Fisheries Service, Silver Spring, Maryland. ",NOAA,,,,
"NMFS. 2010a. Recovery plan for the fin whale (Balaenoptera physalus). National Marine Fisheries Service, Silver Spring, Maryland, 121 pp. ",NOAA,,,,
"NMFS. 2010b. U.S. Atlantic and Gulf of Mexico marine mammal stock assessments: 2010. G.T. Waring, E. Josephson, K. Maze-Foley, and P.E. Rosel (eds.). NOAA Technical Memorandum NMFS-NE-219, National Marine Fisheries Service, Silver Spring, Maryland. ",NOAA,,,,
"NMFS. 2011. Preliminary summer 2010 regional abundance estimate of loggerhead turtles (Caretta caretta) in Northwestern Atlantic Ocean continental shelf waters. U.S. Department of Commerce, Northeast Fisheries Science Center, Reference Document 11-03. ",NOAA,,,,
"NMFS. 2013. National observer program annual report: 2012. National Marine Fisheries Service, Silver Spring, Maryland, 38 pp. ",NOAA,,,,
"NMFS. 2014. Reinitiation of Endangered Species Act (ESA) Section 7 consultation on the continued implementation of the sea turtle conservation regulations under the ESA and the continued authorization of the Southeast U.S. shrimp fisheries in federal waters under the Magnuson-Stevens Fishery Conservation and Management Act (MSFMCA). Consultation No. SER-2013-12255. April 18, 2014. ",NOAA,,,,
"NMFS. 2015. Fisheries of the United States, 2014. U.S. Department of Commerce, NOAA Current Fishery Statistics No.2014. ",NOAA,,,,
"NMFS and USFWS. 1991a. Recovery plan for the U.S. population of Atlantic green turtle. National Marine Fisheries Service, Washington, D.C., 58 pp. ",NOAA,,,,
"NMFS and USFWS. 1991b. Recovery plan for the U.S. population of loggerhead turtle. National Marine Fisheries Service, Washington, D.C., 64 pp. ",NOAA,,,,
"NMFS and USFWS. 1992. Recovery plan for leatherback turtles in the U.S. Caribbean, Atlantic, and Gulf of Mexico. National Marine Fisheries Service, Washington, D.C., 65 pp. ",NOAA,,,,
"NMFS and USFWS. 1993. Recovery plan for hawksbill turtles in the U.S. Caribbean Sea, Atlantic Ocean, and Gulf of Mexico. National Marine Fisheries Service, St. Petersburg, Florida. ",NOAA,,,,
"NMFS and USFWS. 1995. Status reviews for sea turtles listed under the Endangered Species Act of 1973. National Marine Fisheries Service, Silver Spring, Maryland, 139 pp. ",NOAA,,,,
"NMFS and USFWS. 1998a. Recovery plan for the U.S. Pacific population of the green turtle (Chelonia mydas). National Marine Fisheries Service, Silver Spring, Maryland. ",NOAA,,,,
"NMFS and USFWS. 1998b. Recovery plan for the U.S. Pacific population of the leatherback turtle (Dermochelys coriacea). National Marine Fisheries Service, Silver Spring, Maryland. ",NOAA,,,,
"NMFS and USFWS. 2007a. Green sea turtle (Chelonia mydas) 5-year review: summary and evaluation. National Marine Fisheries Service, Silver Spring, Maryland, 102 pp. ",NOAA,,,,
"NMFS and USFWS. 2007b. Hawksbill sea turtle (Eretmochelys imbricata) 5-year review: summary and evaluation. National Marine Fisheries Service, Silver Spring, Maryland, 90 pp. ",NOAA,,,,
"NMFS and USFWS. 2007c. Kemp’s ridley sea turtle (Lepidochelys kempii) 5-year review: summary and evaluation. National Marine Fisheries Service, Silver Spring, Maryland, 50 pp. ",NOAA,,,,
"NMFS and USFWS. 2007d. Leatherback sea turtle (Dermochelys coriacea) 5-year review: summary and evaluation. National Marine Fisheries Service, Silver Spring, Maryland, 79 pp. ",NOAA,,,,
"NMFS and USFWS. 2007e. Loggerhead sea turtle (Caretta caretta) 5-year review: summary and evaluation. National Marine Fisheries Service, Silver Spring, Maryland, 65 pp. ",NOAA,,,,
"NMFS and USFWS. 2008. Recovery plan for the Northwest Atlantic population of the loggerhead turtle (Caretta caretta), second revision. National Marine Fisheries Service, Washington, D.C., 325 pp. ",NOAA,,,,
"NMFS and USFWS. 2013a. Hawksbill sea turtle (Eretmochelys imbricata) 5-year review: summary and evaluation. NOAA, National Marine Fisheries Service, Office of Protected Resources and U.S. Fish and Wildlife Service, Southeast Region, Jacksonville Ecological Services Office.",NOAA,,,,
"NMFS and USFWS. 2013b. Leatherback sea turtle (Dermochelys coriacea) 5-year review: summary and evaluation. NOAA, National Marine Fisheries Service, Office of Protected Resources and U.S. Fish and Wildlife Service, Southeast Region, Jacksonville Ecological Services Office. ",NOAA,,,,
"NMFS, USFWS, and SEMARNAT. 2011. Bi-national recovery plan for the Kemp’s ridley sea turtle (Lepidochelys kempii), second revision. National Marine Fisheries Service, Silver Spring, Maryland. ",NOAA,,,,
"NRC. 1990. Decline of the sea turtles: causes and prevention. National Research Council, Washington, D.C. ",,Organization,,,
"Ogren, L.H. 1989. Distribution of juvenile and subadult Kemp’s ridley sea turtles: preliminary results from 1984-1987 surveys. Pages 116-123 in C.W. Caillouet Jr., and A.M. Landry Jr. (eds.), First International Symposium on Kemp’s Ridley Sea Turtle Biology, Conservation and Management. Texas A&M University, Sea Grant College, Galveston, Texas. ",,,,University,
"Parsons, J.J. 1972. The hawksbill turtle and the tortoise shell trade. Pages 45-60 in Études de Géographie Tropicale Offertes a Pierre Gourou. Mouton, Paris, France. ",,Organization,,,
"Pattillo, M.E., T.E. Czapla, D.M. Nelson, and M.E. Monaco. 1997. Distribution and abundance of fishes and invertebrates in Gulf of Mexico estuaries, Volume II: species life history summaries. ELMR Report No. 11. NOAA/NOS Strategic Environmental Assessment Division, Silver Spring, Maryland, 377 pp. ",NOAA,,,,
"Plotkin, P.T. 2003. Adult migrations and habitat use. Pages 225-241 in P.L. Lutz, J.A. Musick, and J. Wyneken (eds.), The Biology of Sea Turtles, Volume 2. CRC Press, Boca Raton, Florida. ",,,,,Book
"Plotkin, P.T., and A.F. Amos. 1988. Entanglement in and ingestion of marine debris by sea turtles stranded along the South Texas coast. Page 7 in Supplemental Deliverables under Entanglement-Debris Task No. 3. Debris, Entanglement and Possible Causes of Death in Stranded Sea Turtles (FY88).",,Organization,,,
"Plotkin, P.T., and A.F. Amos. 1990. Effects of anthropogenic debris on sea turtles in the northwestern Gulf of Mexico. Pages 736-743 in R.S. Shoumura and M.L. Godfrey (eds.), Proceedings of the Second Internntional Conference on Marine Debris. NOAA Technical Memorandum NMFS SWFSC-154. U.S. Department of Commerce, Honolulu, Hawaii. ",NOAA,,,,
"Price, A.B., and J.L. Gearhart. 2011. Evaluations of turtle excluder device (TED) performance in the U.S. Southeast Atlantic and Gulf of Mexico skimmer trawl fisheries. NOAA Technical Memorandum NMFS-SEFSC-615, 15 pp. ",NOAA,,,,
"Pritchard, P.C.H., and P. Trebbau. 1984. The turtles of Venezuela. Society for the Study of Amphibians. ",,Organization,,,
"Pritchard, P.C.H., P. Bacon, F.H. Berry, A. Carr, J. Feltemyer, R.M. Gallagher, S. Hopkins, R. Lankford, M.R. Marquez, L.H. Ogren, W. Pringle, Jr., H. Reichart, and R. Witham. 1983. Manual of sea turtle research and conservation techniques, second edition. Center for Environmental Education, Washington, D.C. ",,Organization,,,
"Pulver, J.R., E. Scott-Denton, and J.A. Williams. 2012. Characterization of the U.S. Gulf of Mexico skimmer trawl fishery based on observer coverage. NOAA Technical Memorandum NMFS-SEFSC-636, 27 pp. ",NOAA,,,,
"Pulver, J.R., E. Scott-Denton, and J.A. Williams. 2014. Observer coverage of the 2013 Gulf of Mexico skimmer trawl fishery. NOAA Technical Memorandum NMFS-SEFSC-654, 25 pp. ",NOAA,,,,
"Rebel, T.P. 1974. Sea turtles and the turtle industry of the West Indies, Florida and the Gulf of Mexico. University of Miami Press, Coral Gables, Florida. ",,,,,Book
"Renaud, M., G. Gitschlag, E. Klima, A. Shah, J. Nance, C. Caillouet, Z. Zein-Eldin, D. Koi, and F. Patella. 1990. Evaluation of the impacts of turtle excluder devices (TEDs) on shrimp catch rates in the Gulf of Mexico and South Atlantic, March 1988 through July 1989. NOAA Technical Memorandum NMFS-SEFC-254. ",NOAA,,,,
"Rivas-Zinno, F. 2012. Captura incidental de tortugas marinas en Bajos del Solis, Uruguay. Universidad de la Republica Uruguay, Departamento de Ecologia y Evolucion. ",,,,University,
"Ruben, H.J, and S.J. Morreale. 1999. Draft biological assessment for sea turtles in New York and New Jersey Harbor Complex. Unpublished Biological Assessment submitted to National Marine Fisheries Service. ",NOAA,,,,
"SAFMC. 1983. Fishery Management Plan, Regulatory Impact Review and Final Environmental Impact Statement for the Snapper Grouper Fishery of the South Atlantic Region. South Atlantic Fishery Management Council, North Charleston, South Carolina. ",South Atlantic Fishery Management Council,,,,
"SAFMC. 1993. Fishery Management Plan for the Shrimp Fishery of the South Atlantic Region. South Atlantic Fishery Management Council, North Charleston, South Carolina. ",South Atlantic Fishery Management Council,,,,
"SAFMC. 1995. Fishery Management Plan for the Golden Crab Fishery of the South Atlantic Region. South Atlantic Fishery Management Council, North Charleston, South Carolina. ",South Atlantic Fishery Management Council,,,,
"SAFMC. 1998. Comprehensive Amendment Addressing Essential Fish Habitat in Fishery Management Plans of the South Atlantic Region. South Atlantic Fishery Management Council, North Charleston, South Carolina. ",South Atlantic Fishery Management Council,,,,
"SAFMC. 2002. Fishery Management Plan for Pelagic Sargassum Habitat of the South Atlantic Region. South Atlantic Fishery Management Council, North Charleston, South Carolina. ",South Atlantic Fishery Management Council,,,,
"SAFMC. 2003. Fishery Management Plan for the Dolphin and Wahoo Fishery of the Atlantic. South Atlantic Fishery Management Council, North Charleston, South Carolina. ",South Atlantic Fishery Management Council,,,,
"SAFMC. 2008. Final Amendment 7 to the Fishery Management Plan for the Shrimp Fishery of the South Atlantic Region. South Atlantic Fishery Management Council, North Charleston, South Carolina. ",South Atlantic Fishery Management Council,,,,
"SAFMC. 2009. Fishery Ecosystem Plan of the South Atlantic Region. South Atlantic Fishery Management Council, North Charleston, South Carolina. ",South Atlantic Fishery Management Council,,,,
"SAFMC. 2012. Amendment 9 to the Fishery Management Plan for the Shrimp Fishery of the South Atlantic Region. South Atlantic Fishery Management Council, North Charleston, South Carolina. ",South Atlantic Fishery Management Council,,,,
"SAFMC. 2013. Amendment 8 to the Fishery Management Plan for Coral, Coral Reefs, and Live/Hard Bottom Habitats of the South Atlantic Region. South Atlantic Fishery Management Council, North Charleston, South Carolina. ",South Atlantic Fishery Management Council,,,,
"Schmid, J.R., and A. Woodhead. 2000. Von Bertalanffy growth models for wild Kemp’s ridley turtles: analysis of the NMFS Miami Laboratory tagging database. U. S. Dept. of Commerce, National Oceanic and Atmospheric Administration, National Marine Fisheries Service, Southeast Fisheries Science Center, Miami, Florida. ",NOAA,,,,
"Scott-Denton, E., J.A. Williams, and J.R. Pulver. 2014. Observer coverage of the 2014 Gulf of Mexico skimmer trawl fishery. NOAA Technical Memorandum NMFS-SEFSC-666, 27 pp. ",NOAA,,,,
"Seminoff, J.A. 2004. Global status assessment green turtle (Chelonia mydas). Marine Turtle Specialist Group, The World Conservation Union (IUCN), Gland, Switzerland. ",,Organization,,,
"Seminoff, J.A., C.D. Allen, G.H. Balazs, P.H. Dutton, T. Eguchi, H.L. Haas, S.A. Hargrove, M.P. Jensen, D.L. Klemm, A.M. Lauritsen, S.L. MacPherson, P. Opay, E.E. Possardt, S.L. Pultz, E.E. Seney, K.S. Van Houtan, and R.S. Waples. 2015. Status review of the green turtle (Chelonia Mydas) under the Endangered Species Act. NOAA Technical Memorandum, NMFS-SWFSC-539. ",NOAA,,,,
"Shaver, D.J. 2004. Kemp’s ridley sea turtle project at Padre Island National Seashore and Texas sea turtle nesting and stranding 2002 report. Unpublished report, Department of the Interior, U.S. National Park Service. ",US DOI,,,,
"Shigenaka G., R.Z. Hoff, R.A. Yender, and A.J. Mearns. 2010. Oil and sea turtles: biology, planning and response. National Oceanic and Atmospheric Administration National Ocean Service, Office of Response and Restoration. ",NOAA,,,,
"Simpfendorfer, C.A., and T.R. Wiley. 2004. Determination of the distribution of Florida’s remnant sawfish population, and identification of areas critical to their conservation. Mote Marine Laboratory Technical Report, July 2, 2004, 37 pp. ",,Organization,,,
"Snover, M.L. 2002. Growth and ontogeny of sea turtles using skeletochronology: methods, validation and application to conservation. Duke University. ",,,,University,
"Soldevilla, M.S., L.P. Garrison, E. Scott-Denton, and J.M. Nance. 2015. Estimation of marine mammal bycatch mortality in the Gulf of Mexico shrimp otter trawl fishery. NOAA Tech. Memo. NMFS-SEFSC-672, 70 pp. ",NOAA,,,,
"Spotila, J. 2004. Sea turtles: a complete guide to their biology, behavior, and conservation. Johns Hopkins University Press, Baltimore, Maryland. ",,,,University,
"Stacy, B.A., J.L. Keene, and B.A. Schroeder. 2016. Report of the technical expert workshop: developing national criteria for assessing post-interaction mortality of sea turtles in trawl, net, and pot/trap fisheries. NOAA Technical Memorandum NMFS-OPR-53, 110 pp. ",NOAA,,,,
"Stapleton, S., and C. Stapleton. 2006. Tagging and nesting research on hawksbill turtles (Eretmochelys imbricata) at Jumby Bay, Long Island, Antigua, West Indies: 2005 annual report. Jumby Bay Island Company, Ltd. ",,Organization,,,
"Stokes, L., and J. Gearhart. 2016. Summary of Kemp’s ridley and green sea turtle morphometric data in the Southeastern U.S. Atlantic Ocean and Gulf of Mexico. SEFSC Contribution PRBD-2016-01. 28 pp. ",NOAA,,,,
"TEWG. 1998. An assessment of the Kemp’s ridley (Lepidochelys kempii) and loggerhead (Caretta caretta) sea turtle populations in the Western North Atlantic. NOAA Technical Memorandum NMFS-SEFSC-409, 99 pp. ",NOAA,,,,
"TEWG. 2000. Assessment update for the Kemp’s ridley and loggerhead sea turtle populations in the Western North Atlantic. NOAA Technical Memorandum NMFS-SEFSC-444, 115 pp. ",NOAA,,,,
"TEWG. 2007. An assessment of the leatherback turtle population in the Atlantic Ocean. NOAA Technical Memorandum NMFS-SEFSC-555, 116 pp. ",NOAA,,,,
"TEWG. 2009. An assessment of the loggerhead turtle population in the Western North Atlantic Ocean. NOAA Technical Memorandum NMFS-SEFSC-575, 131 pp. ",NOAA,,,,
"Tiwari, M., B.P. Wallace, and M. Girondot. 2013. Dermochelys coriacea (Northwest Atlantic Ocean subpopulation). The IUCN Red List of Threatened Species (e.T46967827A46967830. http://dx.doi.org/10.2305/IUCN.UK.2013-2.RLTS.T46967827A46967830.en). ",,Organization,,,
"Travis, M. 2010. Analysis of Gulf Shrimp Moratorium Permits. NOAA Fisheries Service, Southeast Regional Office, St. Petersburg, Florida, 22 pp. ",NOAA,,,,
"Tucker, A.D. 1988. A summary of leatherback turtle Dermochelys coriacea nesting at Culebra, Puerto Rico from 1984-1987 with management recommendations. U.S. Fish and Wildlife Service. ",US FWS,,,,
"USFWS. 2001. Florida manatee recovery plan, (Trichechus manatus latirostris),third revision. U.S. Fish and Wildlife Service, Atlanta, Georgia, 144 pp. plus appendices. ",US FWS,,,,
"USFWS. 2007. 5-year review of West Indian manatee (Trichechus manatus). Includes both subspecies: Florida manatee, Trichechus manatus latirostris, and Antillean manatee, Trichechus manatus manatus (in Puerto Rico and the U.S. Virgin Islands). USFWS Southeast Region; Jacksonville, Florida, and Boquerón, Puerto Rico. ",US FWS,,,,
"USFWS and NMFS. 1992. Recovery plan for the Kemp’s ridley sea turtle (Lepidochelys kempii). National Marine Fisheries Service, St. Petersburg, Florida, 40 pp. ",US FWS,,,,
"USFWS and NMFS. 2009. Gulf Sturgeon (Acipenser oxyrinchus desotoi) 5-year review: summary and evaluation. National Marine Fisheries Service, St. Petersburg, Florida, 65 pp. ",US FWS,,,,
"USFWS, GSMFC, and NMFS. 1995. U.S. Gulf sturgeon recovery/management plan. Atlanta, Georgia, 170 pp. ",US FWS,,,,
"Van Dam, R.P., and L. Sarti. 1989. Sea turtle biology and conservation on Mona Island, Puerto Rico. Report for 1989. ",,Organization,,,
"Van Dam, R., L. Sarti, and D. Pares J. 1991. The hawksbills of Mona Island, Puerto Rico: report for 1990. Sociedad Chelonia and Departmento, Recursos Naturales, Puerto Rico. ",,Organization,,,
"Wershoven, J.L., and R.W. Wershoven. 1992. Juvenile green turtles in their nearshore habitat of Broward County, Florida: a five year review. In: Proceedings of the 11th Annual Workshop on Sea Turtle Biology and Conservation, M. Salmon and J. Wyneken (compilers). NOAA Technical Memorandum NMFS-SEFC-302:121-123. ",NOAA,,,,
"Whiting, S.D. 2000. The foraging ecology of juvenile green (Chelonia mydas) and hawksbill (Eretmochelys imbricata) sea turtles in north-western Australia. Northern Territory University, Darwin, Australia. ",,,,University,
"Wilkinson, C. 2004. Status of coral reefs of the world: 2004. Australian Institute of Marine Science, ISSN 1447-6185. ",,,,,Book
"Wilson, D., R. Billings, R. Chang, H. Perez, and J. Sellers. 2014. Year 2011 Gulfwide emissions inventory study. U.S. Department of the Interior, Bureau of Ocean Energy Management, Gulf of Mexico OCS Region, New Orleans, Louisiana. OCS Study BOEM 2014-666. ",US DOI,,,,
"Witherington, B.E. 1994. Flotasm, jetsam, post-hatchling loggerheads, and the advecting surface smorgasbord. In: Proceedings of the 14th Annual Symposium of Sea Turtle Biology and Conservation, pp. 166-168, K.A. Bjorndal, A.B. Bolten, D.A. Johnson, and P.J. Eliazar (eds.). NOAA Technical Memorandum NMFS-SEFSC-351. ",NOAA,,,,
"Witzell, W.N. 1983. Synopsis of biological data on the hawksbill sea turtle, Eretmochelys imbricata (Linnaeus, 1766). Food and Agricultural Organization of the United Nations, Rome. ",,Organization,,,