citation,agency,organization,journal,university,book
"Carr, A. 1986. New perspectives on the pelagic stage of sea turtle development. National Oceanic and Atmospheric Administration, National Marine Fisheries Service, Southeast Fisheries Center. NOAA Technical Memorandum NMFS-SEFC-190. ",NOAA,,,,
"CEAA. 1999. Cumulative effects assessment practitioners guide. Section 2.1, Cumulative effects defined. Canadian Environmental Assessment Agency. ",Canadian Environmental Assessment Agency,,,,
"CEQ. 1997. Considering cumulative effects under the National Environmental Policy Act. Council on Environmental Quality, Executive Office of the President, Washington, D.C. ",US Council of Environmental Quality,,,,
"Chaloupka, M.Y., and J.A. Musick. 1997. Age growth and population dynamics. Pages 233-276 in P.L. Lutz, and J.A. Musick (eds), The Biology of Sea Turtles. CRC Press, Boca Raton, Florida. ",,,,,Book
"Church, J.A., J.M. Gregory, P. Huybrechts, M. Kuhn, K. Lambeck, M.T. Nhuan, D. Qin, and P.L. Woodworth. 2001. Changes in sea level. In: Climate Change 2001: The Scientific Basis, Houghton and Ding (eds.). Cambridge University Press, New York. ",,,,,Book
"Clifton, K.B. 2005. Skeletal biomechanics of the Florida manatee (Trichechus manatus latirostris). PhD dissertation, University of Florida, Gainesville, Florida. ",,,,University,
"Conant, T.A., P.H. Dutton, T. Eguchi, S.P. Epperly, C.C. Fahy, M.H. Godfrey, S.L. MacPherson, E.E. Possardt, B.A. Schroeder, J.A. Seminoff, M.L. Snover, C.M. Upite, and B.E. Witherington. 2009. Loggerhead sea turtle (Caretta caretta) 2009 status review under the U.S. Endangered Species Act. Report of the Loggerhead Biological Review Team to the National Marine Fisheries Service, August 2009, 222 pp. ",NOAA,,,,
"Diez, C.E., and R.P. Van Dam. 2007. In-water surveys for marine turtles at foraging grounds of Culebra Archipelago, Puerto Rico. Progress Report: FY 2006-2007. Unpublished technical report. ",,Organization,,,
"Dodd, C.K. 1988. Synopsis of the biological data on the loggerhead sea turtle Caretta caretta (Linnaeus 1758). U.S. Fish and Wildlife Service 88(14). ",US FWS,,,,
"Dow, W., K. Eckert, M. Palmer, and P. Kramer. 2007. An atlas of sea turtle nesting habitat for the wider Caribbean region. The Wider Caribbean Sea Turtle Conservation Network and The Nature Conservancy, Beaufort, North Carolina. ",,Organization,,,
DWH Trustees. 2016. Deepwater Horizon oil spill: final programmatic damage assessment and restoration plan and final programmatic environmental impact statement. Retrieved from http://www.gulfspillrestoration.noaa.gov/restoration-planning/gulf-plan/. ,,Organization,,,
"Eckert, K.L. 1995. Hawksbill sea turtle (Eretmochelys imbricata). Pages 76-108 in National Marine Fisheries Service and U.S. Fish and Wildlife Service Status Reviews for Sea Turtles Listed under the Endangered Species Act of 1973. National Oceanic and Atmospheric Administration, National Marine Fisheries Service, Silver Springs, Maryland. ",NOAA,,,,
"Eckert, K.L., J.A. Overing, and B.B. Lettsome. 1992. Sea turtle recovery action plan for the British Virgin Islands. UNEP Caribbean Environment Programme, Wider Caribbean Sea Turtle Recovery Team and Conservation Network, Kingston, Jamaica. ",,Organization,,,
"Eckert, K.L., B.P. Wallace, J.G. Frazier, S.A. Eckert, and P.C.H. Pritchard. 2012. Synopsis of the biological data on the leatherback sea turtle (Dermochelys coriacea). U.S. Fish and Wildlife Service. ",US FWS,,,,
"Eckert, S.A. 1989. Diving and foraging behavior of the leatherback sea turtle, Dermochelys coriacea. University of Georgia, Athens, Georgia. ",,,,University,
"Epperly, S., L. Avens, L. Garrison, T. Henwood, W. Hoggard, J. Mitchell, J. Nance, J. Poffenberger, C. Sasso, E. Scott-Denton, and C. Yeung. 2002. Analysis of sea turtle bycatch in the commercial shrimp fisheries of southeast U.S. waters and the Gulf of Mexico. NOAA Technical Memorandum NMFS-SEFSC-490. 88pp. ",NOAA,,,,
"Fleming, E.H. 2001. Swimming against the tide: recent surveys of exploitation, trade, and management of marine turtles in the Northern Caribbean. TRAFFIC North America, Washington, D.C. ",,Organization,,,
"Fretey, J. 2001. Biogeography and conservation of marine turtles of the Atlantic coast of Africa. CMS Technical Series Publication Number 6. 429 pp. UNEP/CMS Secretariat, Bonn, Germany. ",,Organization,,,
FWC. 2010. Florida Fish and Wildlife Conservation Commission’s Fish and Wildlife Research Institute 2010 statewide sea turtle nesting totals. Available online at: http://myfwc.com/research/wildlife/sea-turtles/nesting/. ,,Organization,,,
"Gagosian, R.B. 2003. Abrupt climate change: should we be worried? Prepared for a panel on abrupt climate change at the World Economic Forum, Davos, Switzerland, January 27, 2003. 9 pp. ",,Organization,,,
"Gavilan, F.M. 2001. Status and distribution of the loggerhead turtle, Caretta caretta, in the wider Caribbean region. Pages 36-40 in K.L. Eckert and F.A. Abreu Grobois (eds.), Marine Turtle Conservation in the Wider Caribbean Region - A Dialogue for Effective Regional Management, Santo Domingo, Dominican Republic. ",,,,,Book
"Gladys Porter Zoo. 2013. Gladys Porter Zoo’s preliminary annual report on the Mexico/United States of America population restoration project for the Kemp’s ridley sea turtle, Lepidochelys kempii, on the coasts of Tamaulipas, Mexico. ",,Organization,,,
"Gladys Porter Zoo. 2015. Gladys Porter Zoo’s preliminary annual report on the Mexico/United States of America population restoration project for the Kemp’s ridley sea turtle, Lepidochelys kempii, on the coasts of Tamaulipas, Mexico. ",,Organization,,,
"GMFMC. 1979. Fishery Management Plan for the Stone Crab Fishery of the Gulf of Mexico. Gulf of Mexico Fishery Management Council, Tampa, Florida. ",Gulf of Mexico Fishery Management Council,,,,
"GMFMC. 1981. Fishery Management Plan for the Shrimp Fishery of the Gulf, United States Waters. Gulf of Mexico Fishery Management Council, Tampa, Florida. ",Gulf of Mexico Fishery Management Council,,,,
"GMFMC. 1982. Fishery Management Plan for the Reef Fish Fishery of the Gulf of Mexico, United States Waters. Gulf of Mexico Fishery Management Council, Tampa, Florida. ",Gulf of Mexico Fishery Management Council,,,,
"GMFMC. 1986. Secretarial Fishery Management Plan for the Red Drum Fishery of the Gulf of Mexico. Gulf of Mexico Fishery Management Council, Tampa, Florida. ",Gulf of Mexico Fishery Management Council,,,,
"GMFMC. 1998. Generic amendment for addressing essential fish habitat requirements in the following Fishery Management plans of the Gulf of Mexico: Shrimp Fishery of the Gulf of Mexico, United States waters; Red Drum Fishery of the Gulf of Mexico, Reef Fish Fishery of the Gulf of Mexico, Coastal Migratory Pelagic Resources (Mackerel) in the Gulf of Mexico and South Atlantic; Stone Crab Fishery of the Gulf of Mexico; Spiny Lobster Fishery of the Gulf of Mexico; Coral and Coral Reefs of the Gulf of Mexico. Gulf of Mexico Fishery Management Council, Tampa, Florida. ",Gulf of Mexico Fishery Management Council,,,,
"GMFMC. 2004. Final Environmental Impact Statement for the Generic Essential Fish Habitat Amendment to the following Fishery Management plans of the Gulf of Mexico: Shrimp Fishery of the Gulf of Mexico, United States waters; Red Drum Fishery of the Gulf of Mexico, Reef Fish Fishery of the Gulf of Mexico, Coastal Migratory Pelagic Resources (Mackerel) in the Gulf of Mexico and South Atlantic; Stone Crab Fishery of the Gulf of Mexico; Spiny Lobster Fishery of the Gulf of Mexico; Coral and Coral Reefs of the Gulf of Mexico. Gulf of Mexico Fishery Management Council, Tampa, Florida. ",Gulf of Mexico Fishery Management Council,,,,
"GMFMC. 2005. Amendment 13 to the Fishery Management Plan for the Shrimp Fishery of the Gulf. Gulf of Mexico Fishery Management Council, Tampa, Florida. ",Gulf of Mexico Fishery Management Council,,,,
"GMFMC. 2007. Amendment 27 to the reef fish fishery management plan and Amendment 14 to the shrimp fishery management plan. Gulf of Mexico Fishery Management Council, Tampa, Florida. ",Gulf of Mexico Fishery Management Council,,,,
"GMFMC. 2013. Framework action to establish funding responsibilities for the electronic logbook program in the shrimp fishery of the Gulf of Mexico. Gulf of Mexico Fishery Management Council, Tampa, Florida. ",Gulf of Mexico Fishery Management Council,,,,
"GMFMC. 2014. Adjustments to the Annual Catch Limit and Accountability Measure for Royal Red Shrimp, Amendment 16 to the Fishery Management Plan for the Shrimp Fishery of the Gulf of Mexico, U.S. Waters. Gulf of Mexico Fishery Management Council, Tampa, Florida. ",Gulf of Mexico Fishery Management Council,,,,
"GMFMC. 2015. Amendment 16 to the Fishery Management Plan for the Shrimp Fishery of the Gulf of Mexico, U.S. Waters. Gulf of Mexico Fishery Management Council, Tampa, Florida. ",Gulf of Mexico Fishery Management Council,,,,
"GMFMC. 2016a. Draft Options for Amendment 17B to the Fishery Management Plan for the Shrimp Fishery of the Gulf of Mexico, U.S. Waters. Gulf of Mexico Fishery Management Council, Tampa, Florida. ",Gulf of Mexico Fishery Management Council,,,,
"GMFMC. 2016b. Shrimp Permit Moratorium, Final Amendment 17A to the Fishery Management Plan for the Shrimp Fishery of the Gulf of Mexico, U.S. Waters. Gulf of Mexico Fishery Management Council, Tampa, Florida. ",Gulf of Mexico Fishery Management Council,,,,
"GMFMC and SAFMC. 1982a. Fishery Management Plan, Environmental Impact Statement, and Regulatory Impact Review for Spiny Lobster in the Gulf of Mexico and South Atlantic. Gulf of Mexico Fishery Management Council, Tampa, Florida and South Atlantic Fishery Management Council, North Charleston, South Carolina. ",Gulf of Mexico Fishery Management Council,,,,
"GMFMC and SAFMC. 1982b. Fishery Management Plan for Coral and Coral Reefs of the Gulf of Mexico and South Atlantic. Gulf of Mexico Fishery Management Council, Tampa, Florida and South Atlantic Fishery Management Council, North Charleston, South Carolina. ",Gulf of Mexico Fishery Management Council,,,,
"GMFMC and SAFMC. 1985. Fishery Management Plan and Environmental Impact Statement for Coastal Migratory Pelagic Resources (Mackerels) in the Gulf of Mexico and South Atlantic Region. Gulf of Mexico Fishery Management Council, Tampa, Florida and South Atlantic Fishery Management Council, North Charleston, South Carolina. ",Gulf of Mexico Fishery Management Council,,,,
"Gore, R.H. 1992. The Gulf of Mexico. Pineapple Press, Inc. Sarasota Florida. 384 pp. ",,,,,Book
"Graham, T.R. 2009. Scyphozoan jellies as prey for leatherback sea turtles off central California. Master’s Thesis. San Jose State University. ",,,,University,
"Groombridge, B. 1982. Kemp’s ridley or Atlantic ridley, Lepidochelys kempii (Garman 1980). The IUCN Amphibia, Reptilia Red Data Book, pp. 201-208. ",,,,,Book
"Groombridge, B., and R. Luxmoore. 1989. The green turtle and hawksbill (Reptilia: Cheloniidae): world status, exploitation and trade. Secretariat of the Convention on International Trade in Endangered Species of Wild Fauna and Flora, Lausanne, Switzerland. ",,Organization,,,
"Guinotte, J.M., and V.J. Fabry. 2008. Ocean acidification and its potential effects on marine ecosystems. In: The Year in Ecology and Conservation Biology 2008, pp. 320-342, R.S. Ostfeld and W.H. Schlesinger (eds.). Annals of the New York Academy of Sciences. ",,,,,Book
"Guseman, J.L., and L.M. Ehrhart. 1992. Ecological geography of Western Atlantic loggerheads and green turtles: evidence from remote tag recoveries. In: Proceedings of the 11th Annual Workshop on Sea Turtle Biology and Conservation, M. Salmon and J. Wyneken (compilers). NOAA Technical Memorandum NMFS-SEFC-302: 50. ",NOAA,,,,
"Heppell, S.S., M.L. Snover, and L. Crowder. 2003a. Sea turtle population ecology. Pages 275-306 in P. Lutz, J.A. Musick, and J. Wyneken (eds.), The Biology of Sea Turtles. CRC Press, Boca Raton, Florida. ",,,,,Book
"Heppell, S.S., L.B. Crowder, D.T. Crouse, S.P. Epperly, and N.B. Frazer. 2003b. Population models for Atlantic loggerheads: past, present, and future. Pages 255-273 in A. Bolten, and B. Witherington (eds.), Loggerhead Sea Turtles. Smithsonian Books, Washington, D.C. ",,,,,Book
"Heppell, S.S., S.A. Heppell, A.J. Read, and L.B. Crowder. 2005. Effects of fishing on long-lived marine organisms. In: Marine Conservation Biology: the Science of Maintaining the Sea’s Biodiversity, pp. 211-231, E.A. Norse and L.B. Crowder (eds.). Island Press, Washington, D.C. ",,,,,Book
"Hildebrand, H. 1982. A historical review of the status of sea turtle populations in the western Gulf of Mexico. In: Biology and Conservation of Sea Turtles, pp. 447-453, K. Bjorndal (ed.). Smithsonian Institution Press, Washington D.C. ",,,,,Book
"Hillis, Z., and A.L. Mackay. 1989. Research report on nesting and tagging of hawksbill sea turtles Eretmocheys imbricata at Buck Island Reef National Monument, U.S. Virgin Islands, 1987-88. National Park Service, purchase order PX 5380-8-0090. ",National Park Service,,,,
"Hines, K.L., R.A. Rulifson, J.D. Murray, and B. Hines. 1996. Skimmer trawl modifications to reduce bycatch in the inshore brown and pink shrimp fishery in North Carolina. National Marine Fisheries Service, Cooperative Programs Division Project Number 93-SER-049. ",NOAA,,,,
"Hirth, H.F. 1971. Synopsis of biological data on the green turtle Chelonia mydas (Linnaeus) 1758. Food and Agriculture Organization. ",,Organization,,,
"Holland, B.F., Jr. 1989. Evaluation of certified trawl efficiency devices (TEDs) in North Carolina’s nearshore ocean. Final Report project 2-439-R (funded in part by NMFS Award NA87WCD06100), North Carolina Division of Marine Fisheries, Morehead City, North Carolina. ",North Carolina Division of Marine Fisheries,,,,
"IAI. 2007. Preliminary impact assessment of Hurricane Katrina on coastal fishing communities of Mississippi, Alabama, and Louisiana. Impact Assessment, Inc. Technical report prepared for the National Oceanographic and Atmospheric Administration, National Marine Fisheries Service, Silver Spring, Maryland. 311pp. ",NOAA,,,,
"IAI. 2012. Small Business Impacts Associated with the 2010 Oil Spill and Drilling Moratorium in the Gulf of Mexico. Final Technical Report. Impact Assessment, Inc. Prepared for the U.S. Small Business Administration, Office of Advocacy. 147 pp. ",US Small Business Administration,,,,
"IPCC. 2007. Summary for policymakers. In: Climate Change 2007: The Physical Science Basis. Contribution of Working Group I to the Fourth Assessment Report of the Intergovernmental Panel on Climate Change, S. Solomon, D. Quin, M. Manning, Z. Chen, M. Marquis, K.B. Averyt, M. Tignor, and H.L. Miller (eds.). Cambridge University Press, New York.",,Organization,,,
"Jacobson, E.R., S.B. Simpson, Jr., and J.P. Sundberg. 1991. Fibropapillomas in green turtles. In: Research Plan for Marine Turtle Fibropapilloma, G.H. Balazs, and S.G. Pooley (eds.). NOAA Technical Memorandum NMFS-SWFSC-156: 99-100. ",NOAA,,,,
"Jennings, S., and M.J. Kaiser. 1998. The effects of fishing on marine ecosystems. In: Advances in Marine Biology, J.H.S. Blaxter, A.J. Southward, and P.A. Tyler (eds.), 34:201-352. ",,,,,Book
"Jepson, M., and L.L. Colburn. 2013. Development of social indicators of fishing community vulnerability and resilience in the U.S. Southeast and Northeast Regions. U.S. Dept. of Commerce, NOAA Technical Memorandum NMFS-F/SPO-129, 64 pp. ",NOAA,,,,
"Johnson, S.A., and L.M. Ehrhart. 1994. Nest-site fidelity of the Florida green turtle. In: Proceedings of the 13th Annual Symposium on Sea Turtle Biology and Conservation, B.A. Schroeder and B.E. Witherington (compilers). NOAA Technical Memorandum NMFS-SEFSC-341: 83. ",NOAA,,,,
"Lagueux, C.J. 2001. Status and distribution of the green turtle, Chelonia mydas, in the wider Caribbean region. Pages 32-35 in K.L. Eckert and F.A. Abreu Grobois (eds.), Marine Turtle Conservation in the Wider Caribbean Region - A Dialogue for Effective Regional Management, Santo Domingo, Dominican Republic. ",,,,,Book
"Lalli, C.M., and T.R. Parsons. 1997. Biological oceanography: an introduction. Second Edition. Elsevier, Butterworth, and Heinemann, New York. ",,,,,Book
"LDWF. 2016. Shrimp fishery management plan 2015. Louisiana Department of Wildlife and Fisheries, Office of Fisheries, Baton Rouge, Louisiana. 158 pp. ",Louisiana Department of Wildlife and Fisheries,,,,
"Lezama, C. 2009. Impacto de la pesqueria artesanal sobre la tortoga verde (Chelonia mydas) en las costas del Rio de la Plata exterior. Universidad de la República. ",,,,University,
"Liese, C. 2011. 2009 Economics of the federal Gulf shrimp fishery annual report. NOAA Fisheries, Southeast Fisheries Science Center, Miami, Florida. ",NOAA,,,,
"Liese, C. 2013a. 2010 Economics of the federal Gulf shrimp fishery annual report. NOAA Fisheries, Southeast Fisheries Science Center, Miami, Florida. ",NOAA,,,,
"Liese, C. 2013b. 2011 Economics of the federal Gulf shrimp fishery annual report. NOAA Fisheries, Southeast Fisheries Science Center, Miami, Florida. ",NOAA,,,,
"Liese, C. 2013c. 2011 Economics of the federal South Atlantic shrimp fisheries annual report. NOAA Fisheries, Southeast Fisheries Science Center, Miami, Florida. ",NOAA,,,,
"Liese, C. 2014. Economics of the federal Gulf shrimp fishery—2012. NOAA Technical Memorandum NMFS-SEFSC-668, 26 pp. ",NOAA,,,,
"Liese, C. 2016. 2013 Economics of the federal Gulf shrimp fishery annual report. NOAA Fisheries, Southeast Fisheries Science Center, Miami, Florida. ",NOAA,,,,
"Liese, C., and M.D. Travis. 2010. The annual economic survey of federal Gulf shrimp permit holders: implementation and descriptive results for 2008. NOAA Technical Memorandum NMFS-SEFSC-601. ",NOAA,,,,
"Liese, C., M.D. Travis, D. Pina, and J.R. Waters. 2009a. The annual economic survey of federal Gulf shrimp permit holders: report on the design, implementation, and descriptive results for 2006. NOAA Technical Memorandum NMFS-SEFSC-584. ",NOAA,,,,
"Liese, C., M.D. Travis, and J.R. Waters. 2009b. The annual economic survey of federal Gulf shrimp permit holders: implementation and descriptive results for 2007. NOAA Technical Memorandum NMFS-SEFSC-590. ",NOAA,,,,
"Limpus, C.J., and J.D. Miller. 2000. Final report for Australian hawksbill turtle population dynamics project. Queensland Parks and Wildlife Service. ",Queensland Parks and Wildlife Service,,,,
"Lindeboom, H.J., and S.J. de Groot. 1998. Impact II: The effects of different types of fisheries on the North Sea and Irish Sea benthic ecosystems. NIOZ Rapport 1998-1, 404 pp. ",,Organization,,,
"López-Mendilaharsu, M., A. Estrades, M.A.C. Caraccio, M. Hernández, and V. Quirici. 2006. Biología, ecología yetología de las tortugas marinas en la zona costera uru-guaya, Montevideo, Uruguay. Vida Silvestre, Uruguay. ",,Organization,,,
"Lutcavage, M.E., and P.L. Lutz. 1997. Diving physiology. In: Biology and Conservation of Sea Turtles, pp. 387-410, P.L. Lutz and J.A. Musick (eds.). CRC Press, Boca Raton, Florida. ",,,,,Book
"Lutcavage, M., P. Plotkin, B. Witherington, and P. Lutz. 1997. Human impacts on sea turtle survival. Pages 387-409 in P. Lutz and J.A. Musick (eds.), The Biology of Sea Turtles, Volume 1. CRC Press, Boca Raton, Florida. ",,,,,Book
"Mackay, A.L. 2006. 2005 sea turtle monitoring program the East End beaches (Jack’s, Isaac’s, and East End Bay), St. Croix, U.S. Virgin Islands. Nature Conservancy. ",,Organization,,,
"Maharaj, A.M. 2004. A comparative study of the nesting ecology of the leatherback turtle Dermochelys coriacea in Florida and Trinidad. University of Central Florida, Orlando, Florida. ",,,,University,
"Marcovaldi, N., B.B. Gifforni, H. Becker, F.N. Fiedler, and G. Sales. 2009. Sea turtle interactions in coastal net fisheries in Brazil. U.S. National Marine Fisheries Service, Southeast Fisheries Science Center: Honolulu, Hawaii. ",NOAA,,,,
"Márquez M., R. 1990. Sea turtles of the world. An annotated and illustrated catalogue of sea turtle species known to date. Food and Agriculture Organization of the United Nations. Rome, Italy. ",,Organization,,,
"Márquez M., R. 1994. Synopsis of biological data on the Kemp’s ridley sea turtle, Lepidochelys kempii (Garman, 1880). National Oceanic and Atmospheric Administration, National Marine Fisheries Service, Southeast Fisheries Science Center. ",NOAA,,,,
"Matos, R. 1986. Sea turtle hatchery project with specific reference to the leatherback turtle (Dermochelys coriacea), Humacao, Puerto Rico 1986. Puerto Rico Department of Natural Resources, de Tierra, Puerto Rico. ",Puerto Rico Department of Natural Resources,,,,
"McNutt, M, R. Camilli, G. Guthrie, P. Hsieh, V. Labson, B. Lehr, D. Maclay, A. Ratzel, and M. Sogge. 2011. Assessment of flow rate estimates for the Deepwater Horizon / Macondo well oil spill. Flow Rate Technical Group report to the National Incident Command, Interagency Solutions Group, March 10, 2011. ",,Organization,,,
"Meylan, A.B., B. Schroeder, and A. Mosier. 1995. Sea turtle nesting activity in the state of Florida. Florida Marine Research Publications, No. 52. ",,Organization,,,
"Miller, J.D. 1997. Reproduction in sea turtles. Pages 51-58 in P. L. Lutz, and J.A. Musick (eds.), The Biology of Sea Turtles. CRC Press, Boca Raton, Florida. ",,,,,Book
"Miller, A.L., and J.C. Isaacs. 2011. An Economic Survey of the Gulf of Mexico Inshore Shrimp Fishery: Implementation and Descriptive Results for 2008. Gulf States Marine Fisheries Commission Publication Number 195. Ocean Springs, Mississippi. ",,Organization,,,
"Miller, A.L., and J.C. Isaacs. 2014. An Economic Survey of the U.S. Gulf of Mexico Inshore Shrimp Fishery: Descriptive Results for 2012. Gulf States Marine Fisheries Commission Publication, Publication Number 227. Ocean Springs, Mississippi. ",,Organization,,,
"Milliken, T., and H. Tokunaga. 1987. The Japanese sea turtle trade 1970-1986. TRAFFIC (JAPAN), Center for Environmental Education, Washington, D.C. ",,Organization,,,
"Milton S.L., and P.L. Lutz. 2003. Environmental and physiological stress. In: The Biology of Sea Turtles, Volume 2, P.L. Lutz, J. Musick, and J. Wyneken (eds.). CRC Press, Boca Raton, Florida. ",,,,,Book
"Milton, S., P. Lutz, G. Shigenaka, R.Z. Hoff, R.A. Yender, and A.J. Mearns. 2003. Oil and sea turtles: biology, planning and response. National Oceanic and Atmospheric Administration National Ocean Service, Office of Response and Restoration, Hazardous Materials Response Division, August 2003. ",NOAA,,,,
"Mo, C.L. 1988. Effect of bacterial and fungal infection on hatching success of olive ridley sea turtle eggs. World Wildlife Fund-U.S. ",,Organization,,,
"Mortimer, J.A., and M. Donnelly. 2008. Hawksbill turtle (Eretmochelys imbricata). International Union for Conservation of Nature and Natural Resources. ",,Organization,,,
"Murphy, T.M., and S.R. Hopkins. 1984. Aerial and ground surveys of marine turtle nesting beaches in the southeast region. National Oceanic and Atmospheric Administration, National Marine Fisheries Service, Southeast Fisheries Center. ",NOAA,,,,
"Musick, J.A., and C.J. Limpus. 1997. Habitat utilization and migration in juvenile sea turtles. Pages 137-163 in P.L. Lutz, and J.A. Musick (eds.), The Biology of Sea Turtles. CRC Press, New York, New York. ",,,,,Book
"Nance, J., W. Keithly, Jr., C. Caillouet, Jr., J. Cole, W. Gaidry, B. Gallaway, W. Griffin, R. Hart, and M. Travis. 2006. Estimation of effort, maximum sustainable yield, and maximum economic yield in the shrimp fishery of the Gulf of Mexico. Report of the Ad Hoc Shrimp Effort Working Group to the Gulf of Mexico Fishery Management Council, 85 pp. ",Gulf of Mexico Fishery Management Council,,,,
"NCDMF. 2015. North Carolina shrimp fishery management plan, draft Amendment 1. North Carolina Department of Environment and Natural Resources, North Carolina Division of Marine Fisheries, Morehead City, North Carolina. 519 pp. ",North Carolina Department of Environment and Natural Resources,,,,
"Nelson, D.M. 1992. Distribution and abundance of fishes and invertebrates in Gulf of Mexico Estuaries, Volume I: data summaries. ELMR Report No. 10. NOAA/NOS Strategic Environmental Assessments Division, Rockville, Maryland, 273 pp. ",NOAA,,,,
"Nichols, S. 1984. Updated assessment of brown, white, and pink shrimp in the U.S. Gulf of Mexico. National Marine Fisheries Service, Southeast Fisheries Center, Miami, Florida, 21 pp. ",NOAA,,,,
"NMFS. 1991. Recovery plan for the humpback whale. (Megaptera novaengliae). Prepared by the Humpback Whale Recovery Team for the National Marine Fisheries Service, Silver Spring, Maryland, 105 pp. ",NOAA,,,,
"NMFS. 1998a. Recovery plan for the blue whale (Balaenoptera musculus). Prepared by Reeves R.R., P.J. Clapham, R.L. Brownell, Jr., and G.K. Silber for the National Marine Fisheries Service, Silver Spring, Maryland. ",NOAA,,,,
"NMFS. 1998b. Recovery plan for the shortnose sturgeon (Acipenser brevirostrum). Prepared by the Shortnose Sturgeon Recovery Team for the National Marine Fisheries Service, Silver Spring, Maryland, 104 pp. ",NOAA,,,,
"NMFS. 2001. Stock assessments of loggerhead and leatherback sea turtles and an assessment of the impact of the pelagic longline fishery on the loggerhead and leatherback sea turtles of the western North Atlantic. National Oceanic and Atmospheric Administration, National Marine Fisheries Service, Southeast Fisheries Science Center. ",NOAA,,,,
"NMFS. 2002a. Endangered Species Act Section 7 consultation on shrimp trawling in the Southeastern United States, under the sea turtle conservation regulations and as managed by the fishery management plans for shrimp in the South Atlantic and Gulf of Mexico. December 2, 2002. ",NOAA,,,,
